#600568,中珠控股：2012年年度报告.pdf,http://pg.jrj.com.cn/acc/CN_DISC\STOCK_TIME\2013\04\27\600568_nb_62439860.PDF,1863k
#600568,中珠控股：2013年第一季度报告.pdf,http://pg.jrj.com.cn/acc/CN_DISC\STOCK_TIME\2013\04\27\600568_jb1_62439903.PDF,374k
#600568,中珠控股：2013年半年度报告.pdf,http://pg.jrj.com.cn/acc/CN_DISC\STOCK_TIME\2013\08\31\600568_nb_63029100.PDF,1443k
#600568,中珠控股：2013年第三季度报告.pdf,http://pg.jrj.com.cn/acc/CN_DISC\STOCK_TIME\2013\10\31\600568_jb3_63218347.PDF,420k
#600568,中珠控股：2013年年度报告.pdf,http://pg.jrj.com.cn/acc/CN_DISC\STOCK_TIME\2014\03\01\600568_nb_63620537.PDF,1910k
#600568,中珠控股：2014年第一季度报告.pdf,http://pg.jrj.com.cn/acc/CN_DISC\STOCK_TIME\2014\04\30\600568_jb1_63954600.PDF,413k
#600568,中珠控股：关于对2013年年度报告事后审核意见的回复公告.pdf,http://pg.jrj.com.cn/acc/CN_DISC\STOCK_TIME\2014\05\06\600568_nb_63970616.PDF,244k
#600568,中珠控股：2014年半年度报告.pdf,http://pg.jrj.com.cn/acc/CN_DISC\STOCK_TIME\2014\08\30\600568_nb_1200189237.PDF,2104k
#600568,中珠控股：2014年第三季度报告.pdf,http://pg.jrj.com.cn/acc/CN_DISC\STOCK_TIME\2014\10\31\600568_jb3_1200356643.PDF,498k
#600568,中珠控股：2014年年度报告.pdf,http://pg.jrj.com.cn/acc/CN_DISC\STOCK_TIME\2015\03\19\600568_nb_1200714981.PDF,2784k
#600568,中珠控股：2015年第一季度报告.pdf,http://pg.jrj.com.cn/acc/CN_DISC\STOCK_TIME\2015\04\30\600568_jb1_1200948532.PDF,477k
#600568,中珠控股：关于上海证券交易所对公司2014年年度报告的事后审核意见函的回复公告.pdf,http://pg.jrj.com.cn/acc/CN_DISC\STOCK_TIME\2015\04\14\600568_nb_1200829241.PDF,926k
#600568,中珠控股：2014年年度报告修订版).pdf,http://pg.jrj.com.cn/acc/CN_DISC\STOCK_TIME\2015\04\14\600568_nb_1200829242.PDF,2880k
#600568,中珠控股：2015年半年度报告.pdf,http://pg.jrj.com.cn/acc/CN_DISC\STOCK_TIME\2015\08\29\600568_nb_1201520465.PDF,2305k
#600568,中珠控股：2015年第三季度报告.pdf,http://pg.jrj.com.cn/acc/CN_DISC\STOCK_TIME\2015\10\31\600568_jb3_1201745504.PDF,527k
#600568,中珠控股：国金证券股份有限公司关于公司非公开发行股票2015年持续督导年度报告.pdf,http://pg.jrj.com.cn/acc/CN_DISC\STOCK_TIME\2016\04\16\600568_nb_1202188766.PDF,186k
#600568,中珠控股：2015年年度报告.pdf,http://pg.jrj.com.cn/acc/CN_DISC\STOCK_TIME\2016\04\16\600568_nb_1202188778.PDF,3145k
#600568,中珠控股：2016年第一季度报告.pdf,http://pg.jrj.com.cn/acc/CN_DISC\STOCK_TIME\2016\04\23\600568_jb1_1202232098.PDF,562k
#600568,中珠医疗：2016年半年度报告.pdf,http://pg.jrj.com.cn/acc/CN_DISC\STOCK_TIME\2016\08\31\600568_nb_1202657992.PDF,2655k
#600568,中珠医疗：2016年第三季度报告.pdf,http://pg.jrj.com.cn/acc/CN_DISC\STOCK_TIME\2016\10\29\600568_jb3_1202804206.PDF,572k
#600568,中珠医疗：国金证券股份有限公司关于中珠医疗控股股份有限公司非公开发行股票2016年持续督导年度报告.pdf,http://pg.jrj.com.cn/acc/CN_DISC\STOCK_TIME\2017\04\29\600568_nb_1203428038.PDF,194k
#600568,中珠医疗：2017年第一季度报告.pdf,http://pg.jrj.com.cn/acc/CN_DISC\STOCK_TIME\2017\04\29\600568_jb1_1203428042.PDF,467k
#600568,中珠医疗：2016年年度报告.pdf,http://pg.jrj.com.cn/acc/CN_DISC\STOCK_TIME\2017\04\29\600568_nb_1203428023.PDF,3441k
#600568,中珠医疗：关于收到上海证券交易所对2016年年度报告的事后审核问询函的公告.pdf,http://pg.jrj.com.cn/acc/CN_DISC\STOCK_TIME\2017\05\27\600568_nb_1203571796.PDF,212k
#600568,中珠医疗：关于延期回复上海证券交易所对公司2016年年度报告事后审核问询函的公告.pdf,http://pg.jrj.com.cn/acc/CN_DISC\STOCK_TIME\2017\06\08\600568_nb_1203598526.PDF,130k
#600568,中珠医疗：关于上海证券交易所对公司2016年年度报告事后审核问询函的回复公告.pdf,http://pg.jrj.com.cn/acc/CN_DISC\STOCK_TIME\2017\06\16\600568_nb_1203617679.PDF,688k
#600568,中珠医疗：2016年年度报告修订稿).pdf,http://pg.jrj.com.cn/acc/CN_DISC\STOCK_TIME\2017\06\16\600568_nb_1203617682.PDF,3447k
#600568,中珠医疗：关于公司2016年年度报告修订说明的公告.pdf,http://pg.jrj.com.cn/acc/CN_DISC\STOCK_TIME\2017\06\16\600568_nb_1203617681.PDF,213k
#600568,中珠医疗：立信会计师事务所特殊普通合伙)关于对上海证券交易所出具的《关于对中珠医疗控股股份有限公司2016年年度报告的事后审核问询函》的回复函信会师函字[2017]第ZE027号).pdf,http://pg.jrj.com.cn/acc/CN_DISC\STOCK_TIME\2017\06\16\600568_nb_1203617680.PDF,7696k
#600568,中珠医疗：关于公司2016年年度报告事后审核问询函回复的更正公告.pdf,http://pg.jrj.com.cn/acc/CN_DISC\STOCK_TIME\2017\08\30\600568_nb_1203895054.PDF,115k
#600568,中珠医疗：2017年半年度报告.pdf,http://pg.jrj.com.cn/acc/CN_DISC\STOCK_TIME\2017\08\31\600568_nb_1203907802.PDF,2638k
#600568,中珠医疗：2017年第三季度报告.pdf,http://pg.jrj.com.cn/acc/CN_DISC\STOCK_TIME\2017\10\31\600568_jb3_1204097489.PDF,528k
#600568,中珠医疗：2017年年度报告.pdf,http://pg.jrj.com.cn/acc/CN_DISC\STOCK_TIME\2018\04\28\600568_nb_1204831625.PDF,3643k
#600568,中珠医疗：2018年第一季度报告.pdf,http://pg.jrj.com.cn/acc/CN_DISC\STOCK_TIME\2018\04\28\600568_jb1_1204831615.PDF,471k
#600568,中珠医疗：国金证券股份有限公司关于许德来增持中珠医疗控股股份有限公司股份之定期报告持续督导意见2017年年度报告).pdf,http://pg.jrj.com.cn/acc/CN_DISC\STOCK_TIME\2018\05\12\600568_nb_1204932436.PDF,84k
#600568,中珠医疗：关于上海证券交易所对公司2017年年度报告事后审核问询函的回复公告.pdf,http://pg.jrj.com.cn/acc/CN_DISC\STOCK_TIME\2018\06\04\600568_nb_1205030731.PDF,841k
#600568,中珠医疗：关于延期回复上海证券交易所对公司2017年年度报告事后审核问询函的公告.pdf,http://pg.jrj.com.cn/acc/CN_DISC\STOCK_TIME\2018\05\26\600568_nb_1205006713.PDF,137k
#600568,中珠医疗：2017年年度报告修订版.pdf,http://pg.jrj.com.cn/acc/CN_DISC\STOCK_TIME\2018\06\04\600568_nb_1205030728.PDF,3666k
#600568,中珠医疗：关于收到上海证券交易所对公司2017年年度报告的事后审核问询函的公告.pdf,http://pg.jrj.com.cn/acc/CN_DISC\STOCK_TIME\2018\05\21\600568_nb_1204975448.PDF,210k
#600568,中珠医疗：立信会计师事务所特殊普通合伙关于上海证券交易所《关于对中珠医疗控股股份有限公司2017年年度报告的事后审核问询函》上证公函[2018]0568号的回复说明.pdf,http://pg.jrj.com.cn/acc/CN_DISC\STOCK_TIME\2018\06\04\600568_nb_1205030730.PDF,9392k
#600568,中珠医疗：关于公司2017年年度报告修订说明的公告.pdf,http://pg.jrj.com.cn/acc/CN_DISC\STOCK_TIME\2018\06\04\600568_nb_1205030729.PDF,207k
#600568,中珠医疗：2018年半年度报告.pdf,http://pg.jrj.com.cn/acc/CN_DISC\STOCK_TIME\2018\08\31\600568_nb_1205363091.PDF,2758k
#600568,中珠医疗：2018年第三季度报告.pdf,http://pg.jrj.com.cn/acc/CN_DISC\STOCK_TIME\2018\10\31\600568_jb3_1205561887.PDF,531k
