#601127,小康股份：2016年半年度报告.pdf,http://pg.jrj.com.cn/acc/CN_DISC\STOCK_TIME\2016\08\25\031564041_nb_1202612657.PDF,2861k
#601127,小康股份：2016年第三季度报告.pdf,http://pg.jrj.com.cn/acc/CN_DISC\STOCK_TIME\2016\10\26\031564041_jb3_1202786277.PDF,1349k
#601127,小康股份：2016年年度报告.pdf,http://pg.jrj.com.cn/acc/CN_DISC\STOCK_TIME\2017\03\20\031564041_nb_1203177785.PDF,2765k
#601127,小康股份：中信建投证券股份有限公司关于重庆小康工业集团股份有限公司2016年持续督导年度报告书.pdf,http://pg.jrj.com.cn/acc/CN_DISC\STOCK_TIME\2017\03\20\031564041_nb_1203177774.PDF,309k
#601127,小康股份：2017年第一季度报告.pdf,http://pg.jrj.com.cn/acc/CN_DISC\STOCK_TIME\2017\04\28\031564041_jb1_1203420295.PDF,462k
#601127,小康股份：2017年半年度报告.pdf,http://pg.jrj.com.cn/acc/CN_DISC\STOCK_TIME\2017\08\18\601127_nb_1203810097.PDF,2265k
#601127,小康股份：2017年第三季度报告.pdf,http://pg.jrj.com.cn/acc/CN_DISC\STOCK_TIME\2017\10\27\601127_jb3_1204080919.PDF,558k
#601127,小康股份：中信建投证券股份有限公司关于重庆小康工业集团股份有限公司2017年持续督导年度报告书.pdf,http://pg.jrj.com.cn/acc/CN_DISC\STOCK_TIME\2018\04\17\113016_nb_1204642847.PDF,435k
#601127,小康股份：关于收到上海证券交易所《关于对重庆小康工业集团股份有限公司2017年年度报告的事后审核问询函》的公告.pdf,http://pg.jrj.com.cn/acc/CN_DISC\STOCK_TIME\2018\04\27\113016_nb_1204805296.PDF,161k
#601127,小康股份：2017年年度报告修订版.pdf,http://pg.jrj.com.cn/acc/CN_DISC\STOCK_TIME\2018\05\05\113016_nb_1204909242.PDF,3089k
#601127,小康股份：重庆华康资产评估土地房地产估价有限责任公司关于对重庆小康工业集团股份有限公司2017年年度报告的事后审核问询函上证公函[2018]0387号)之反馈意见回复.pdf,http://pg.jrj.com.cn/acc/CN_DISC\STOCK_TIME\2018\05\05\113016_nb_1204909243.PDF,735k
#601127,小康股份：2017年年度报告.pdf,http://pg.jrj.com.cn/acc/CN_DISC\STOCK_TIME\2018\04\17\113016_nb_1204642806.PDF,2961k
#601127,小康股份：2018年第一季度报告.pdf,http://pg.jrj.com.cn/acc/CN_DISC\STOCK_TIME\2018\04\28\113016_jb1_1204826369.PDF,514k
#601127,小康股份：关于回复上海证券交易所《关于对重庆小康工业集团股份有限公司2017年年度报告的事后审核问询函》的公告.pdf,http://pg.jrj.com.cn/acc/CN_DISC\STOCK_TIME\2018\05\05\113016_nb_1204909072.PDF,420k
#601127,小康股份：关于2017年年度报告环境信息情况的补充公告.pdf,http://pg.jrj.com.cn/acc/CN_DISC\STOCK_TIME\2018\07\03\113016_nb_1205113802.PDF,227k
#601127,小康股份：2017年年度报告修订版.pdf,http://pg.jrj.com.cn/acc/CN_DISC\STOCK_TIME\2018\07\03\113016_nb_1205113805.PDF,3111k
#601127,小康股份：2018年半年度报告.pdf,http://pg.jrj.com.cn/acc/CN_DISC\STOCK_TIME\2018\08\30\113016_nb_1205354742.PDF,2595k
#601127,小康股份：2018年第三季度报告.pdf,http://pg.jrj.com.cn/acc/CN_DISC\STOCK_TIME\2018\10\30\113016_jb3_1205552340.PDF,510k
