#603963,大理药业：2017年第三季度报告.pdf,http://pg.jrj.com.cn/acc/CN_DISC\STOCK_TIME\2017\10\30\603963_jb3_1204090879.PDF,483k
#603963,大理药业：2018年第一季度报告.pdf,http://pg.jrj.com.cn/acc/CN_DISC\STOCK_TIME\2018\04\27\603963_jb1_1204799858.PDF,452k
#603963,大理药业：2017年年度报告.pdf,http://pg.jrj.com.cn/acc/CN_DISC\STOCK_TIME\2018\04\27\603963_nb_1204799840.PDF,2302k
#603963,大理药业：信永中和会计师事务所关于大理药业股份有限公司2017年年度报告事后审核问询函的回复.pdf,http://pg.jrj.com.cn/acc/CN_DISC\STOCK_TIME\2018\05\25\603963_nb_1204999898.PDF,527k
#603963,大理药业：关于延期回复上海证券交易所《关于对大理药业股份有限公司2017年度报告的事后审核问询函》的公告.pdf,http://pg.jrj.com.cn/acc/CN_DISC\STOCK_TIME\2018\05\23\603963_nb_1204981892.PDF,58k
#603963,大理药业：关于收到上海证券交易所《关于对大理药业股份有限公司2017年度报告的事后审核问询函》的公告.pdf,http://pg.jrj.com.cn/acc/CN_DISC\STOCK_TIME\2018\05\16\603963_nb_1204946278.PDF,217k
#603963,大理药业：中信证券股份有限公司关于《关于对大理药业股份有限公司2017年年度报告的事后审核问询函》之回复.pdf,http://pg.jrj.com.cn/acc/CN_DISC\STOCK_TIME\2018\05\25\603963_nb_1204999899.PDF,2116k
#603963,大理药业：关于2017年年度报告修订说明的公告.pdf,http://pg.jrj.com.cn/acc/CN_DISC\STOCK_TIME\2018\05\25\603963_nb_1204999897.PDF,225k
#603963,大理药业：独立董事关于上海证券交易所对公司2017年年度报告的事后审核问询函回复的独立意见.pdf,http://pg.jrj.com.cn/acc/CN_DISC\STOCK_TIME\2018\05\25\603963_nb_1204999900.PDF,582k
#603963,大理药业：信永中和会计师事务所关于对大理药业股份有限公司2018年半年度报告的事后审核问询函的回复.pdf,http://pg.jrj.com.cn/acc/CN_DISC\STOCK_TIME\2018\09\05\603963_nb_1205372200.PDF,264k
#603963,大理药业：关于延期回复上海证券交易所《关于对大理药业股份有限公司2018年半年度报告的事后审核问询函》的公告.pdf,http://pg.jrj.com.cn/acc/CN_DISC\STOCK_TIME\2018\08\29\603963_nb_1205348499.PDF,58k
#603963,大理药业：关于2017年年度报告事后审核问询函的回复公告.pdf,http://pg.jrj.com.cn/acc/CN_DISC\STOCK_TIME\2018\05\25\603963_nb_1204999895.PDF,616k
#603963,大理药业：关于收到上海证券交易所《关于对大理药业股份有限公司2018年半年度报告的事后审核问询函》的公告.pdf,http://pg.jrj.com.cn/acc/CN_DISC\STOCK_TIME\2018\08\23\603963_nb_1205316556.PDF,207k
#603963,大理药业：2017年年度报告修订版.pdf,http://pg.jrj.com.cn/acc/CN_DISC\STOCK_TIME\2018\05\25\603963_nb_1204999896.PDF,2383k
#603963,大理药业：2018年半年度报告.pdf,http://pg.jrj.com.cn/acc/CN_DISC\STOCK_TIME\2018\08\15\603963_nb_1205286642.PDF,1891k
#603963,大理药业：中信证券股份有限公司关于《关于对大理药业股份有限公司2018年半年度报告的事后审核问询函》之回复.pdf,http://pg.jrj.com.cn/acc/CN_DISC\STOCK_TIME\2018\09\05\603963_nb_1205372201.PDF,548k
#603963,大理药业：关于2018年半年度报告修订说明的公告.pdf,http://pg.jrj.com.cn/acc/CN_DISC\STOCK_TIME\2018\09\05\603963_nb_1205372199.PDF,201k
#603963,大理药业：关于2018年半年度报告事后审核问询函的回复公告.pdf,http://pg.jrj.com.cn/acc/CN_DISC\STOCK_TIME\2018\09\05\603963_nb_1205372197.PDF,399k
#603963,大理药业：2018年第三季度报告.pdf,http://pg.jrj.com.cn/acc/CN_DISC\STOCK_TIME\2018\10\30\603963_jb3_1205556032.PDF,496k
#603963,大理药业：2018年半年度报告修订版.pdf,http://pg.jrj.com.cn/acc/CN_DISC\STOCK_TIME\2018\09\05\603963_nb_1205372198.PDF,1931k
