#603843,正平股份：2016年第三季度报告.pdf,http://pg.jrj.com.cn/acc/CN_DISC\STOCK_TIME\2016\10\31\603843_jb3_1202806772.PDF,0k
#603843,正平股份：申万宏源证券承销保荐有限责任公司关于正平路桥建设股份有限公司2016年度持续督导年度报告书.pdf,http://pg.jrj.com.cn/acc/CN_DISC\STOCK_TIME\2017\04\21\603843_nb_1203346498.PDF,224k
#603843,正平股份：2016年年度报告.pdf,http://pg.jrj.com.cn/acc/CN_DISC\STOCK_TIME\2017\04\21\603843_nb_1203346486.PDF,2494k
#603843,正平股份：2017年第一季度报告.pdf,http://pg.jrj.com.cn/acc/CN_DISC\STOCK_TIME\2017\04\28\603843_jb1_1203420590.PDF,448k
#603843,正平股份：2016年年度报告修订稿.pdf,http://pg.jrj.com.cn/acc/CN_DISC\STOCK_TIME\2017\05\08\603843_nb_1203483818.PDF,2534k
#603843,正平股份：关于2016年年度报告修订的说明-1203483817.pdf,http://pg.jrj.com.cn/acc/CN_DISC\STOCK_TIME\2017\05\08\603843_nb_1203483817.PDF,249k
#603843,正平股份：2017年半年度报告.pdf,http://pg.jrj.com.cn/acc/CN_DISC\STOCK_TIME\2017\08\30\603843_nb_1203897477.PDF,1983k
#603843,正平股份：2017年第三季度报告.pdf,http://pg.jrj.com.cn/acc/CN_DISC\STOCK_TIME\2017\10\31\603843_jb3_1204098884.PDF,482k
#603843,正平股份：关于2017年第三季度报告的补充公告.pdf,http://pg.jrj.com.cn/acc/CN_DISC\STOCK_TIME\2017\11\10\603843_jb3_1204129359.PDF,286k
#603843,正平股份：2017年第三季度报告修订版.pdf,http://pg.jrj.com.cn/acc/CN_DISC\STOCK_TIME\2017\11\10\603843_jb3_1204129360.PDF,526k
#603843,正平股份：2017年年度报告.pdf,http://pg.jrj.com.cn/acc/CN_DISC\STOCK_TIME\2018\04\16\603843_nb_1204629166.PDF,2764k
#603843,正平股份：申万宏源证券承销保荐有限责任公司关于公司2017年度持续督导年度报告书.pdf,http://pg.jrj.com.cn/acc/CN_DISC\STOCK_TIME\2018\04\16\603843_nb_1204629169.PDF,204k
#603843,正平股份：2018年第一季度报告.pdf,http://pg.jrj.com.cn/acc/CN_DISC\STOCK_TIME\2018\04\26\603843_jb1_1204797171.PDF,504k
#603843,正平股份：关于2017年年度报告修订的说明.pdf,http://pg.jrj.com.cn/acc/CN_DISC\STOCK_TIME\2018\06\06\603843_nb_1205038578.PDF,358k
#603843,正平股份：关于收到上海证券交易所对公司2017年年度报告的事后审核问询函的公告.pdf,http://pg.jrj.com.cn/acc/CN_DISC\STOCK_TIME\2018\05\17\603843_nb_1204948833.PDF,237k
#603843,正平股份：关于延期回复上海证券交易所对公司2017年年度报告的事后审核问询函的公告.pdf,http://pg.jrj.com.cn/acc/CN_DISC\STOCK_TIME\2018\05\23\603843_nb_1204982745.PDF,141k
#603843,正平股份：希格玛会计师事务所关于对正平路桥建设股份有限公司2017年年度报告的事后审核问询函有关问题的答复.pdf,http://pg.jrj.com.cn/acc/CN_DISC\STOCK_TIME\2018\06\06\603843_nb_1205038579.PDF,5148k
#603843,正平股份：2017年年度报告修订版.pdf,http://pg.jrj.com.cn/acc/CN_DISC\STOCK_TIME\2018\06\06\603843_nb_1205038576.PDF,2797k
#603843,正平股份：关于上海证券交易所对公司2017年年度报告的事后审核问询函的回复公告.pdf,http://pg.jrj.com.cn/acc/CN_DISC\STOCK_TIME\2018\06\06\603843_nb_1205038575.PDF,1908k
#603843,正平股份：2018年半年度报告.pdf,http://pg.jrj.com.cn/acc/CN_DISC\STOCK_TIME\2018\08\27\603843_nb_1205333667.PDF,2226k
#603843,正平股份：2018年第三季度报告.pdf,http://pg.jrj.com.cn/acc/CN_DISC\STOCK_TIME\2018\10\30\603843_jb3_1205556536.PDF,532k
